<?xml version="1.0" encoding="UTF-8"?>

<!-- <!DOCTYPE konyvek SYSTEM "HD_konyv.dtd"> -->

<konyvek 
xmlns:xsi="http://www.w3.org/2001/XMLSchema-instance"
xsi:noNamespaceSchemaLocation="NG_konyv.xsd">
	<konyv id="1" >
		<cim>Clean Code</cim>
		<kiadasiev>2008</kiadasiev>
		<kiado>&lt;XML&gt; Robert C. Martin</kiado>
		<szerzo>Robert C. Martin</szerzo>
        <abstract>Book for clean coding.</abstract>
	</konyv>
	
	<konyv id="2" >
		<cim>Clean Architecture</cim>
		<kiadasiev>2017</kiadasiev>
		<kiado>&lt;XML&gt; Robert C. Martin</kiado>
		<szerzo>Robert C. Martin</szerzo>
		<abstract>Book for coding.</abstract>
	</konyv>
</konyvek>